{
  "$schema": "https://json-schema.org/draft/2020-12/schema",
  "$id": "https://github.com/yy003x/runtime/resources/schema/runtime.schema.json",
  "title": "SN Runtime Configuration",
  "type": "object",
  "additionalProperties": false,
  "properties": {
    "agent": {
      "type": "object",
      "additionalProperties": false,
      "properties": {
        "tools": {
          "type": "array",
          "maxItems": 256,
          "uniqueItems": true,
          "items": {
            "type": "string",
            "pattern": "^[A-Za-z][A-Za-z0-9_-]{0,63}$"
          },
          "default": ["read_file", "list_directory"]
        },
        "workspace_roots": {
          "type": "array",
          "uniqueItems": true,
          "x-sn-clean-unique": true,
          "items": {
            "type": "string",
            "pattern": "^/"
          }
        },
        "max_rounds": {
          "type": "integer",
          "minimum": 1,
          "maximum": 128,
          "default": 16
        },
        "max_tool_calls": {
          "type": "integer",
          "minimum": 1,
          "maximum": 1024,
          "default": 64
        },
        "max_total_tokens": {
          "type": "integer",
          "minimum": 0,
          "maximum": 9223372036854775807
        },
        "max_wall_time": {
          "type": "string",
          "x-sn-duration-min": "1s",
          "x-sn-duration-max": "24h",
          "allOf": [
            {
              "pattern": "^\\+?(?:(?:[0-9]+(?:\\.[0-9]*)?|\\.[0-9]+)(?:ns|us|µs|μs|ms|s|m|h))+$"
            },
            {
              "pattern": "[1-9]"
            }
          ],
          "default": "15m"
        }
      }
    },
    "scheduler": {
      "type": "object",
      "additionalProperties": false,
      "properties": {
        "workers": {
          "type": "integer",
          "minimum": 1,
          "maximum": 32,
          "default": 1
        },
        "poll_interval": {
          "type": "string",
          "x-sn-duration-min": "10ms",
          "x-sn-duration-max": "1m",
          "allOf": [
            {
              "pattern": "^\\+?(?:(?:[0-9]+(?:\\.[0-9]*)?|\\.[0-9]+)(?:ns|us|µs|μs|ms|s|m|h))+$"
            },
            {
              "pattern": "[1-9]"
            }
          ],
          "default": "250ms"
        }
      }
    },
    "run": {
      "type": "object",
      "additionalProperties": false,
      "properties": {
        "settled_retention": {
          "type": "string",
          "x-sn-duration-min": "1h",
          "x-sn-duration-max": "8760h",
          "allOf": [
            {
              "pattern": "^\\+?(?:(?:[0-9]+(?:\\.[0-9]*)?|\\.[0-9]+)(?:ns|us|µs|μs|ms|s|m|h))+$"
            },
            {
              "pattern": "[1-9]"
            }
          ],
          "default": "168h"
        },
        "reaper": {
          "type": "object",
          "additionalProperties": false,
          "properties": {
            "interval": {
              "type": "string",
              "x-sn-duration-min": "0",
              "x-sn-duration-max": "1h",
              "anyOf": [
                {
                  "const": "0"
                },
                {
                  "allOf": [
                    {
                      "pattern": "^\\+?(?:(?:[0-9]+(?:\\.[0-9]*)?|\\.[0-9]+)(?:ns|us|µs|μs|ms|s|m|h))+$"
                    },
                    {
                      "pattern": "[1-9]"
                    }
                  ]
                }
              ],
              "default": "5m"
            },
            "paused_ttl": {
              "type": "string",
              "x-sn-duration-min": "0",
              "x-sn-duration-max": "720h",
              "anyOf": [
                {
                  "const": "0"
                },
                {
                  "allOf": [
                    {
                      "pattern": "^\\+?(?:(?:[0-9]+(?:\\.[0-9]*)?|\\.[0-9]+)(?:ns|us|µs|μs|ms|s|m|h))+$"
                    },
                    {
                      "pattern": "[1-9]"
                    }
                  ]
                }
              ],
              "default": "30m"
            },
            "needs_reconciliation_ttl": {
              "type": "string",
              "x-sn-duration-min": "0",
              "x-sn-duration-max": "720h",
              "anyOf": [
                {
                  "const": "0"
                },
                {
                  "allOf": [
                    {
                      "pattern": "^\\+?(?:(?:[0-9]+(?:\\.[0-9]*)?|\\.[0-9]+)(?:ns|us|µs|μs|ms|s|m|h))+$"
                    },
                    {
                      "pattern": "[1-9]"
                    }
                  ]
                }
              ],
              "default": "24h"
            }
          },
          "default": {
            "interval": "5m",
            "paused_ttl": "30m",
            "needs_reconciliation_ttl": "24h"
          }
        }
      }
    },
    "tmux": {
      "type": "object",
      "additionalProperties": false,
      "properties": {
        "server_mode": {
          "type": "string",
          "enum": ["default", "dedicated"],
          "default": "default"
        }
      }
    }
  }
}
